{
  "id": "en:lesson:greetings-and-introductions",
  "title": "Greetings and Introductions",
  "language": "en",
  "level": "A1",
  "links": {
    "grammar": [
      {
        "topic_id": "en:grammar:present-simple-be",
        "manual_url": "https://cosylanguages.github.io/COSYmanuals/manuals/en/grammar/a1/topics/present-simple-be.html"
      }
    ],
    "communication": [
      {
        "phrase_id": "en:general:greetings-and-introductions:hello-nice-to-meet-you",
        "manual_url": "https://cosylanguages.github.io/COSYmanuals/manuals/en/communication/a1/topics/greetings-and-introductions.html"
      }
    ]
  }
}
